{
  "case_id": "B011",
  "name": "four_agent_golden",
  "category": "golden",
  "description": "Golden four-agent E2E: analyst + knowledge + product + report specialists, parallel branches, artifacts with lineage, evals, checkpoints, monitor observations — COMPLETED.",
  "input": {
    "max_concurrency": 2,
    "graph": [
      {
        "task_id": "task_0",
        "task_type": "client_profile"
      },
      {
        "task_id": "task_1",
        "task_type": "requirement_analysis",
        "dependencies": [
          "task_0"
        ]
      },
      {
        "task_id": "task_2",
        "task_type": "risk_analysis",
        "dependencies": [
          "task_0",
          "task_1"
        ]
      },
      {
        "task_id": "task_3",
        "task_type": "knowledge_search",
        "dependencies": [
          "task_1"
        ]
      },
      {
        "task_id": "task_4",
        "task_type": "coverage_gap",
        "dependencies": [
          "task_0",
          "task_1",
          "task_2"
        ]
      },
      {
        "task_id": "task_5",
        "task_type": "solution",
        "dependencies": [
          "task_1",
          "task_2",
          "task_4"
        ]
      },
      {
        "task_id": "task_6",
        "task_type": "product_candidates",
        "dependencies": [
          "task_5",
          "task_3"
        ]
      },
      {
        "task_id": "task_7",
        "task_type": "report_generation",
        "dependencies": [
          "task_0",
          "task_1",
          "task_2",
          "task_6"
        ]
      }
    ],
    "scripts": {
      "task_0": "profile",
      "task_1": "req",
      "task_2": "risk",
      "task_3": "know",
      "task_4": "coverage_gap",
      "task_5": "solution",
      "task_6": "product",
      "task_7": "report"
    }
  },
  "expected": {
    "terminal_status": "completed",
    "required_agents": [
      "insurance_analyst",
      "knowledge_specialist",
      "product_specialist",
      "report_specialist"
    ],
    "required_artifacts": [
      "client-profile",
      "requirement-analysis",
      "risk-assessment",
      "knowledge-evidence",
      "coverage-gap-analysis",
      "solution-plan",
      "product-candidates",
      "insurance-report"
    ],
    "required_events": [
      "agent_started",
      "task_completed",
      "checkpoint_created",
      "monitor_started"
    ],
    "forbidden_events": [
      "replan_triggered",
      "approval_waiting",
      "runtime_paused"
    ],
    "graph_revision": 1
  }
}