{
  "case_id": "B009",
  "name": "hotl_notify",
  "category": "hotl",
  "description": "HOTL-A: a runtime failure raises signals -> NOTIFY; the human is an observer only — the run continues autonomously to a terminal state (never WAITING_HUMAN).",
  "input": {
    "graph": [
      {
        "task_id": "task_0",
        "task_type": "client_profile"
      },
      {
        "task_id": "task_1",
        "task_type": "requirement_analysis",
        "dependencies": [
          "task_0"
        ]
      },
      {
        "task_id": "task_2",
        "task_type": "risk_analysis",
        "dependencies": [
          "task_0",
          "task_1"
        ]
      },
      {
        "task_id": "task_3",
        "task_type": "coverage_gap",
        "dependencies": [
          "task_0",
          "task_1",
          "task_2"
        ]
      },
      {
        "task_id": "task_4",
        "task_type": "solution",
        "dependencies": [
          "task_1",
          "task_2",
          "task_3"
        ]
      },
      {
        "task_id": "task_5",
        "task_type": "product_candidates",
        "dependencies": [
          "task_0",
          "task_3",
          "task_4"
        ]
      },
      {
        "task_id": "task_6",
        "task_type": "report_generation",
        "dependencies": [
          "task_0",
          "task_1",
          "task_2",
          "task_5"
        ]
      }
    ],
    "planner_graphs": [
      [
        {
          "task_id": "task_0",
          "task_type": "client_profile"
        },
        {
          "task_id": "task_1",
          "task_type": "requirement_analysis",
          "dependencies": [
            "task_0"
          ]
        },
        {
          "task_id": "task_2",
          "task_type": "risk_analysis",
          "dependencies": [
            "task_0",
            "task_1"
          ]
        },
        {
          "task_id": "task_3",
          "task_type": "coverage_gap",
          "dependencies": [
            "task_0",
            "task_1",
            "task_2"
          ]
        },
        {
          "task_id": "task_6",
          "task_type": "report_generation",
          "dependencies": [
            "task_0",
            "task_1",
            "task_2"
          ]
        }
      ]
    ],
    "scripts": {
      "task_0": "profile",
      "task_1": "req",
      "task_2": "risk",
      "task_3": "coverage_gap",
      "task_4": "plain:输入不完整，无法产出方案。",
      "task_5": "product",
      "task_6": "report"
    }
  },
  "expected": {
    "terminal_status": "completed",
    "required_events": [
      "monitor_signal_detected",
      "intervention_notified"
    ],
    "forbidden_events": [
      "approval_waiting",
      "runtime_paused"
    ],
    "graph_revision": 2
  }
}