{
  "case_id": "B010",
  "name": "hotl_pause_resume",
  "category": "hotl",
  "description": "HOTL-B: the intervention policy (high=PAUSE) pauses the runtime at a safe barrier after the replan budget exhausts; a human RESUME continues to a terminal state.",
  "input": {
    "graph": [
      {
        "task_id": "task_0",
        "task_type": "client_profile"
      },
      {
        "task_id": "task_1",
        "task_type": "requirement_analysis",
        "dependencies": [
          "task_0"
        ]
      },
      {
        "task_id": "task_2",
        "task_type": "risk_analysis",
        "dependencies": [
          "task_0",
          "task_1"
        ]
      },
      {
        "task_id": "task_3",
        "task_type": "coverage_gap",
        "dependencies": [
          "task_0",
          "task_1",
          "task_2"
        ]
      },
      {
        "task_id": "task_4",
        "task_type": "solution",
        "dependencies": [
          "task_1",
          "task_2",
          "task_3"
        ]
      },
      {
        "task_id": "task_5",
        "task_type": "product_candidates",
        "dependencies": [
          "task_0",
          "task_3",
          "task_4"
        ]
      },
      {
        "task_id": "task_6",
        "task_type": "report_generation",
        "dependencies": [
          "task_0",
          "task_1",
          "task_2",
          "task_5"
        ]
      }
    ],
    "max_replans": 1,
    "planner_graphs": [
      "{invalid json",
      "{still invalid",
      "{third invalid"
    ],
    "intervention_policy": {
      "high": "PAUSE"
    },
    "scripts": {
      "task_0": "profile",
      "task_1": "req",
      "task_2": "risk",
      "task_3": "coverage_gap",
      "task_4": "plain:输入不完整，无法产出方案。",
      "task_5": "product",
      "task_6": "report"
    },
    "human_steps": [
      {
        "action": "resume"
      }
    ]
  },
  "expected": {
    "terminal_status": "needs_review",
    "required_events": [
      "intervention_required",
      "runtime_paused",
      "runtime_resuming",
      "runtime_resumed"
    ],
    "max_replans": 1
  }
}