{
  "case_id": "B008",
  "name": "human_approval",
  "category": "hitl",
  "description": "High-impact replan pauses in WAITING_HUMAN; a human APPROVES and the Harness resumes to COMPLETED (Phase 9 gateway intact under Phase 10).",
  "input": {
    "graph": [
      {
        "task_id": "task_0",
        "task_type": "client_profile"
      },
      {
        "task_id": "task_1",
        "task_type": "requirement_analysis",
        "dependencies": [
          "task_0"
        ]
      },
      {
        "task_id": "task_2",
        "task_type": "risk_analysis",
        "dependencies": [
          "task_0",
          "task_1"
        ]
      },
      {
        "task_id": "task_3",
        "task_type": "coverage_gap",
        "dependencies": [
          "task_0",
          "task_1",
          "task_2"
        ]
      },
      {
        "task_id": "task_4",
        "task_type": "solution",
        "dependencies": [
          "task_1",
          "task_2",
          "task_3"
        ]
      },
      {
        "task_id": "task_5",
        "task_type": "product_candidates",
        "dependencies": [
          "task_0",
          "task_3",
          "task_4"
        ]
      },
      {
        "task_id": "task_6",
        "task_type": "report_generation",
        "dependencies": [
          "task_0",
          "task_1",
          "task_2",
          "task_5"
        ]
      }
    ],
    "approval_policy": true,
    "planner_graphs": [
      [
        {
          "task_id": "task_0",
          "task_type": "client_profile"
        },
        {
          "task_id": "task_1",
          "task_type": "requirement_analysis",
          "dependencies": [
            "task_0"
          ]
        },
        {
          "task_id": "task_2",
          "task_type": "risk_analysis",
          "dependencies": [
            "task_0",
            "task_1"
          ]
        },
        {
          "task_id": "task_3",
          "task_type": "coverage_gap",
          "dependencies": [
            "task_0",
            "task_1",
            "task_2"
          ]
        },
        {
          "task_id": "task_6",
          "task_type": "report_generation",
          "dependencies": [
            "task_0",
            "task_1",
            "task_2"
          ]
        }
      ]
    ],
    "scripts": {
      "task_0": "profile",
      "task_1": "req",
      "task_2": "risk",
      "task_3": "coverage_gap",
      "task_4": "plain:输入不完整，无法产出方案。",
      "task_5": "product",
      "task_6": "report"
    },
    "human_steps": [
      {
        "action": "approve"
      }
    ]
  },
  "expected": {
    "terminal_status": "completed",
    "required_events": [
      "approval_requested",
      "approval_waiting",
      "approval_approved",
      "approval_resumed"
    ],
    "graph_revision": 2,
    "max_replans": 1
  }
}